DOI,Journal_Book,Title,Year,Authors,Experimental_Study,N,Topic,Topic_medium,Topic_Family,Stimulus,Stimulus_medium,Stimulus_Family,Framing,Output,Output_medium,Output_Family,Method,Emotion,Emotion_Coarse,Emotion_Role,Key_Findings
,Science Communication,Catalyzing Public Engagement With Climate Change Through Informal Science Learning Centers,2017,Geiger et al.,Yes,7285,Climate Change,,Environment,Pre-training/post-training presentation,In-person,Other,None,"Understanding,Hopefulness,Intention to act","Epistemic processes,Emotional,Action related","Epistemic,Affective,Behavioral",Visitors' questionnaire,Hope,Joy,Output,(1) Training presenters increase effectiveness of communication
,Science Communication,Using a News Article to Convey Climate Science Consensus Information,2021,Rhode et al.,Yes,1048,Climate Change,,Environment,News article,Articles,Text,None,Perception of scientific consesus,Message perception,Epistemic,Perception of consensus questionnaire,None,None,None,"(1) Scientific consensus statement increase perception of scientific consensus,but does not affect other Climate Change attitudes"
,Science Communication,Aesthetics and Astronomy: Studying the Public’s Perception and Understanding of Imagery From Space,2010,Smith et al.,Yes,8866,Space,,Other,Images,Pictures,Image,None,Understanding,Epistemic processes,Epistemic,Science understanding questionnaire,None,None,None,(1) non-experts are more likely to focus on aesthetic or emotional values of images
,Science Communication,"After the Flood: Anger,Attribution,and the Seeking of Information",2008,Griffin et al.,Yes,401,Flooding,,Environment,"TV,News article,Radio","Video&TV,Articles,Radio","Text,Image,Sound",None,"Information seeking,Information processing,Perceived risk","Epistemic processes,Epistemic processes,Subject perception","Epistemic,Behavioral",Questionnaire,"Anger,Trust","Anger,Trust",Input,"(1) Anger is associated with information seeking behaviour and processing,as well as greater risk judgment,a greater sense of personal efficacy,lower trust"
,Science Communication,One or Many? The Influence of Episodic and Thematic Climate Change Frames on Policy Preferences and Individual Behavior Change,2011,Hart,Yes,120,Climate Change,,Environment,News article,Articles,Text,"episodic,thematic","Policy support,Intention to act","Action related,Action related",Behavioral,Questionnaire,None,None,N/A,"(1) exposure to thematic frames associated with more support for policies than exposure to episodic frame
(2) no framing effect on disposition for individual behavior change"
,Science Communication,The Effects of Uncertainty Frames in Three Science Communication Topics,2019,Gustafson & Rice,Yes,2247,"Climate Change,GMO,Machinery hazards",,"Environment,Technology,Technology",News article,Articles,Text,Deficient/technical/scientific/consensus,"Perceived certainty,Perceived credibility,Intention to act","Message perception,Messenger perception,Action related","Behavioral,Epistemic","Questionnaire,credibility scale",None,None,N/A,(1) Portraying scientific findings in uncertainty frames does not have significant effects
,Science Communication,"Should Scientists Talk About GMOs Nicely? Exploring the Effects of Communication Styles,Source Expertise,and Preexisting Attitude",2019,Yuan et al.,Yes,416,GMO,,Technology,Blog article,Online,Text,"agressive/nonagressive,scientists/non-scientist","Perceived likability,Perceived message quality","Messenger perception,Message perception","Behavioral,Attitudinal",Questionnaire,None,None,N/A,(1) Writer likability and perceived expertise was significant (?)
,Science Communication,"Testing Links Among Uncertainty,Affect,and Attitude Toward a Health Behavior",2018,Fung et al.,Yes,334,"General environment,General Health",,"Environment,Health",None,Other,Other,None,"Information seeking,Information processing,Perceived risk,Intention to act","Epistemic processes,Epistemic processes,Subject perception,Action related","Epistemic,Behavioral",Questionnaire,"Worry,Anger","Fear,Anger",Input,(1) worry and anger influence uncertainty judgments and attitudes toward fish avoidance and information insufficiency
,Science Communication,Viruses Going Viral: Impact of Fear-Arousing Sensationalist Social Media Messages on User Engagement,2019,ali et al.,Yes,786,Virus,,Health,Facebook posts,Online,Text,None,Engagement,Other,Behavioral,"Commenting,clicking reaction button,shareing post,efficacy measure",Fear,Fear,Input,(1) fear arousal increase user engagement
,Science Communication,"What,Me Worry? The Role of Affect in Information Seeking and Avoidance",2012,Yang & Kahlor,Yes,736,Climate Change,,Environment,Questionnaire,Other,Text,None,Information seeking,Epistemic processes,Behavioral,risk perception questionnaire,"Worry,Anxiety,Fear,Hope,Happiness,Excitedness","Fear,Fear,Fear,Joy,Joy,Joy",Input,(1) negative affect drives information seeking
,Science Communication,Laughing With Science: The Influence of Audience Approval on Engagement,2020,Cacciatore et al.,Yes,217,General Science,,Other,Video clip,Video&TV,Image,laughter/no laughter,"Epistemic Processes,Affective response","Epistemic processes,Emotional","Behavioral,Affective",Questionnaire,Mirth,Joy,"Input,Output",(1) Affective response is positively linked to engagement
,Science Communication,From White Lab Coats and Crazy Hair to Actual Scientists: Exploring the Impact of Researcher Interaction and Performing Arts on Students’ Perceptions and Motivation for Science,2018,Mallén et al.,Yes,135,STEM,,Other,In-person  stand up and improv theater,In-person,Other,Type of framing,"Perception of scientists,Interest in science","Messenger perception,Emotional",Behavioral,"free-listing,pre- and post-survey",None,None,N/A,"(1) Drama based technieques increase interest in scientific careers
(2) interaction with scientists reduce stereotyped perception"
,Science Communication,"Countering the “Harmless E-Cigarette” Myth: The Interplay of Message Format,Message Sidedness,and Prior Experience With E-Cigarette Use in Misinformation Correction",2020,Wang & Huang,Yes,294,Cigarettes,,Health,Instagram message + 4 corrective messages,Online,"Text,Image",None,Understanding,Epistemic processes,Epistemic,Questionnaire,None,None,N/A,(1) stories more emotionally involving than nonstories but does not reduce counterarguing when used as correctives
,Science Communication,How Effective Are Concrete and Abstract Climate Change Images? The Moderating Role of Construal Level in Climate Change Visual Communication,2021,Duan et al.,Yes,448,Climate Change,,Environment,Images of different General text/color/illustrative scales,Pictures,Image,abstract/concrete,Intention to act,Action related,Behavioral,Questionnaire,Unspecified,None,Input,(1) concrete images does not lead to  increased level of concern
,Science Communication,Tacit Understandings of Health Literacy: Interview and Survey Research With Health Journalists,2009,Hinnant et al.,Yes,396,General Health,,Health,Interview questions,Other,Text,None,Understanding,Epistemic processes,Epistemic,"Interview,Questionnaire",None,None,N/A,None
,Science Communication,To Eat or Not to Eat: Framing of GMOs in American Media and Its Effects on Attitudes and Behaviors,2020,Pjesivac et al.,Yes,182,GMO,,Technology,News sample,Articles,Text,risk/opportunity,"Intention to act,Observed behavior","Action related,Action related",Behavioral,"Questionnaire,observed behavior in choice of apple","Fear,Fear,Hope","Fear,Fear,Joy",Input,"(1) Framng affect attitudes and can change them. 
(2) affect behavioral intentions but not actual behavior"
,Science Communication,The Effects of the “War on Science” Frame on Scientists’ Credibility,2019,Hardy et al.,Yes,1024,General Science,,Other,Blog article,Online,Text,war on science/challenge for science/neglect of science,Perceived credibility,Messenger perception,Behavioral,Questionnaire,Unspecified,None,Input,(1) War on science frame makes conservatives report lower agreement with scientist credibility index
,Science Communication,Debunking Misinformation About Genetically Modified Food Safety on Social Media: Can Heuristic Cues Mitigate Biased Assimilation?,2021,Wang & Huang,Yes,330,GMO,,Technology,Facebook post,Online,Text,None,"Understanding,Perceived credibility","Epistemic processes,Messenger perception",Epistemic,Questionnaire,None,None,N/A,(1) Corrective information can counteract influence of misinformation
,Science Communication,Mother Nature’s Fury: Antagonist Metaphors for Natural Disasters Increase Forecasts of Their Severity and Encourage Evacuation,2021,Hauser et al.,Yes,1936,Natural disasters,,Environment,Vignette,Other,Text,antagonist/literal,Perceived risk,Subject perception,Epistemic,Questionnaire,None,None,N/A,"(1) antagonist framed increase perception of severity
(2) Metaphors are effective for risk communication"
,Science Communication,“Social Change” and “Status Quo” Framing Effects on Risk Perception: An Exploratory Experiment,2006,Durfee,Yes,111,General environment,,Environment,News article,Articles,Text,Social change/status quo,Perceived risk,Subject perception,Epistemic,risk perception questionnaire,None,None,N/A,(1) social change framing increase rissk awareness
,Science Communication,Information Insufficiency and Information Seeking: An Experiment,2016,Hwang & Jeong,Yes,307,General Health,,Health,Vignette,Other,Text,low/high distance,Information seeking,Epistemic processes,Behavioral,information-seeking questionnaire,None,None,N/A,(1) high suffiency threshold result in greater information seeking intention
,Science Communication,The Impact of Message Source on the Effectiveness of Communications About Climate Change,2019,Bolsen et al.,Yes,1850,Climate Change,,Environment,General article,Articles,Text,threat to environment/USA,Perceived threat,Subject perception,Epistemic,threat perception questionnaire,Trust,Love,N/A,(1) Messages attributed to military leaders or republican party leaders can enhance impact of appeal.
,Science Communication,Early Exposures to Ecogenomics: Effects of Priming and Web Site Interactivity Among Adolescents,2010,Bos et al.,Yes,273,Emergen technologies,,Technology,Webpage,Online,Text,None,"Information processing,Attitude change","Epistemic processes,Emotional","Epistemic,Attitudinal","Attitude questionnaire,observed time invested in information-processing,cognitive load questionnaire",None,None,N/A,(1) Priming does not affect attitude development.
,Science Communication,Increasing Information Seeking About Antibiotic Risks: Testing a Clinical Intervention Message Using the Risk Information Seeking and Processing Model,2020,Brinker et al.,Yes,400,Antibiotics,,Health,Text message,Other,Text,None,"Information seeking,Perceived risk","Epistemic processes,Subject perception","Behavioral,Epistemic",risk perception Questionnaire,None,None,N/A,(1) risk information messages increase perception of information insufficiency and information seeking
,Science Communication,Predicting Intentions to Engage With Scientific Messages on Twitter: The Roles of Mirth and Need for Humor,2020,Yeo et al.,Yes,1530,General Science,,Other,Twitter message,Online,Text,None,"Intention to act,Attitude change","Action related,Emotional","Behavioral,Attitudinal",Questionnaire,"Mirth,Mirth","Joy,Joy",Input,(1) humor mediates engagement intentions
,Science Communication,“Knowledge Is Power”: A Mixed-Methods Study Exploring Adult Audience Preferences for Engagement and Learning Formats Over 3 Years of a Health Science Festival,2015,Rogers et al.,Yes,661,General Health,,Health,Lecture + discussion + lab experiment,In-person,Other,None,Engagement,Other,Behavioral,Open question self-report,None,None,N/A,(1) lectures work better than dialogue formats
,Science Communication,"The Power of Being Transported: Efficacy Beliefs,Risk Perceptions,and Political Affiliation in the Context of Climate Change",2020,Bieniek-Tabasco et al.,Yes,391,Climate Change,,Environment,Video clip,Video&TV,Image,transport high/low,"Perceived risk,Efficacy beliefs","Subject perception,Emotional","Behavioral,Epistemic","Risk perception questionnaire,efficacy belief questionnaire",None,None,N/A,"(1) transportation affects efficacy beliefs and risk perception
(1) Political belief affects efficacy beliefs and rsk perceptions"
,Science Communication,"Learning From Science News via Interactive and Animated Data Visualizations: An Investigation Combining Eye Tracking,Online Survey,and Cued Retrospective Reporting",2020,Greussing et al.,Yes,45,General Science,,Other,News article,Articles,Text,static/interactive/interactive+animated,"Attention,Recollection","Epistemic processes,Epistemic processes",Epistemic,"eye tracking,information recall,involvement questionnaire",None,None,N/A,(1) interactivity and animation engage audience more strongly -- translates into highr learning
,Science Communication,Science Information in Fictional Movies: Effects of Context and Gender,2010,Barriga et al.,Yes,96,General Science,,Other,Video clip,Video&TV,Image,Transport: High/none,Resistance to misinformation,Epistemic processes,Epistemic,Questionnaire,None,None,N/A,(1) incorrect science is accepted as true from movies depend on gender of participant and the centrality of information in relation to the plot
,Science Communication,Putting Environmental Infographics Center Stage: The Role of Visuals at the Elaboration Likelihood Model’s Critical Point of Persuasion,2015,Lazard & Atkinson,Yes,168,General environment,,Environment,Webpage,Online,"Text,Image",text/infographic,Information processing,Epistemic processes,Behavioral,Questionnaire,None,None,N/A,(1) visual content is important for persuasiveness of message
,Science Communication,Hedged Language and Partisan Media Influence Belief in Science Claims,2020,Butterfuss et al.,Yes,335,General Science,,Other,Scientific claims: Certain/hedged,Other,Text,correct/misinformation,Perceived credibility,Messenger perception,Epistemic,Questionnaire,None,None,N/A,"(1) hedged language influence belief in information for individuals with certain epistemic profiles
(1) higher faith in instititutoin leads to lower belief in claims from scientific sources"
,Science Communication,Third-Person Perception of Science Narratives: The Case of Climate Change Denial,2018,Dahlstrom,Yes,428,Climate Change,,Environment,News article,Articles,Text,narrative/non-narrative,"Perceived persuasiveness,Influence of message","Message perception,Other",Epistemic,Questionnaire,None,None,N/A,"(1) Individuals are aware of influence of narratives and can resist the influence when they perceive the message to have negative influence
(2) otherwise they underestimate influence of narratives"
,Science Communication,Can a Personality Trait Predict Talk About Science?: Sensation Seeking as a Science Communication Targeting Variable,2007,Hwang & Southwell,Yes,667,Scientific topic,,Other,TV news,Video&TV,Image,None,Engagement,Other,Behavioral,Questionnaire,None,None,N/A,(1) Sensation seeking predicts talk about science
,Science Communication,Science Exemplars in the Eye of the Beholder: How Exposure to Online Science Information Affects Attitudes,2015,Knobloch-Westerwcik et al.,Yes,276,General Science,,Other,General article,Articles,Text,exemplar/numeric,Attitude change,Emotional,Attitudinal,"observed exposure,attitude questionnaire",None,None,N/A,(1) Exemplar reading fosterede longer reading amongst high empathy individuals but less exposure among high-nmumeracy individuals
,Science Communication,The Impact of Climate Change–Related Imagery and Text on Public Opinion and Behavior Change,2016,Hart & Feldman,Yes,1575,Climate Change,,Environment,News article,Articles,"Text,Image","image,text","Perceived importance,Intention to act","Subject perception,Action related",Epistemic,Questionnaire,None,None,N/A,"(1) Perceived efficacy and issue importance correlate with  change in behavior
(2) exposure to images does not negatively affect perceived efficacy or perceived importance"
,Science Communication,"How Involvement,Citation Style,and Funding Source Affect the Credibility of University Scientists",2002,Sprecker,Yes,77,None,,Other,News article,Articles,Text,"public/private,quote/paraphrase",Perceived credibility,Messenger perception,Epistemic,credibility questionnaire,None,None,N/A,(1) funding source or citation style does not affect perceived credibility
,Science Communication,Environmental Science in the Media: Effects of Opposing Viewpoints on Risk and Uncertainty Perceptions,2015,Kortenkmap et al.,Yes,247,General environment,,Environment,News article,Articles,Text,None,Perceived risk,Subject perception,Epistemic,risk perception questionnaire,None,None,N/A,(1) reading discredited opposiing viewpoint influence risk and uncertainty perception similarly as reading balanced opposiing viewpooints
,Public Understanding of Science,Emotion and judgments of scientific research,2020,Drummond & Fishhoff,Yes,705,General Health,,Health,News article,Articles,Text,None,"Perceived trust,Qualitative judgment","Messenger perception,Other",Epistemic,"scientific understanding questionnaire,judgment questionnaire,trust questionnaire,reasoning ability test","Fear,Anger,Disgust,Happiness,Sadness,Surprise","Fear,Anger,Anger,Joy,Sadness,Surprise",Input,(1) disgust increse negative judgment of research and scientists.
,Public Understanding of Science,Audience responses to television news coverage of medical advances: The mediating role of audience emotions and identification,2014,Hong,Yes,99,General Health,,Health,TV news,Video&TV,Image,human exemplar: yes/no,Perceived quality,Message perception,Epistemic,Questionnaire,"Hope,Fear,Anger,Relief","Joy,Fear,Anger,Joy",Input,(1) news stories with human example intensify positive emotions
,Public Understanding of Science,Disgusting microbes: The effect of disgust on perceptions of risks related to modifying microbiomes,2019,Yeo et al.,Yes,1005,Microbes,,Health,News article,Articles,Text,"digust/no disgust,human/no human",Perceived risk,Subject perception,Epistemic,Questionnaire,Disgust,Anger,Input,(1) disgust increase risk perception
,Public Understanding of Science,"Does a picture tell a thousand words? The uses of digitally produced,multimodal pictures for communicating information about Alzheimer’s disease",2015,Dobos et al.,Yes,206,General Health,,Health,Picture,Pictures,Image,None,Understanding,Epistemic processes,Epistemic,Questionnaire,Anger,Anger,Input,"(1) pictures are useful for evoking emotions,rather than convey spicific messages"
,Public Understanding of Science,Fostering Climate Change consensus: The role of intimacy in group discussions,2021,van Swol et al.,Yes,329,Climate Change,,Environment,News article,Articles,Text,None,Opinion change,Other,Behavioral,Questionnaire,None,None,N/A,(1) intimacy increases likelihood of reaching consensus and change of opinion
,Public Understanding of Science,Public perceptions of expert disagreement: Bias and incompetence or a complex and random world?,2017,Dieckmann et al.,Yes,1500,General Science,,Other,"News article,TV news","Articles,Video&TV","Text,Image",paper/online/television,Perception of expert disputes,Messenger perception,Epistemic,"cognitive ability questiionnaire,self-report questionnaire",None,None,N/A,"(1) people with low education and low self-knowledge attribute expert disbutes to incompetence
(2) people with high self-report knowledge attribute dispute to ideological or financial reasons
(3) high education attribute disputes to natural factors such as complexity
"
,Public Understanding of Science,Call them COVIDiots: Exploring the effects of aggressive communication style and psychological distance in the communication of COVID-19,2021,Chu et al.,Yes,464,COVID,,Health,Letter from a doctor,Other,Text,"close/distant,neutral/agressive","Perceived likability,Perceived message quality","Messenger perception,Message perception",Attitudinal,Questionnaire,Aggression,Anger,Input,(1) agressive commuinication may generate positive outcome when dealing with public understanding
,Public Understanding of Science,Relationships among affective factors and preferred engagement in science-related activities,2012,Lin et al.,Yes,8375,General Science,,Other,Natural variables,Other,Text,None,Understanding,Epistemic processes,Epistemic,Questionnaire,None,None,N/A,(1) development of science competency may not be the best way to ensure public engagement and undderstanding of science
,Public Understanding of Science,A review of the effects of uncertainty in public science communication,2020,Gustafson & Rice,Yes,48,Sience Communication,,Other,None,Other,Other,None,Perceived credibility,Messenger perception,Epistemic,Literature review,Uncertainty,Sadness,Input,(1) most credibility-reduction effects of uncertainty are from consensus uncertainty
,Public Understanding of Science,Stop avoiding the inevitable: The effects of anthropomorphism in science writing for non-experts,2021,McGellin et al.,Yes,174,General Science,,Other,General text,Other,Text,Anthromorphic/un-anthromorphic,Understanding,Epistemic processes,Epistemic,Questionnaire,None,None,N/A,(1) Anthropomorphism is evocative without causing significant misconceptions
,Public Understanding of Science,Hot topics in science communication: Aggressive language decreases trustworthiness and credibility in scientific debates,2019,König & Jucks,Yes,221,Climate Change,,Environment,Video,Video&TV,Image,aggressive/non-aggressive,Perceived trust,Messenger perception,Behavioral,Questionnaire,Trust,Love,Input,"(1) person introduced as a lobbyist decrease perceived trustworthiness
(2) Aggressive language is perceived as less trustworthy"
,Public Understanding of Science,Shifting public engagement: How media coverage of Climate Change conferences affects Climate Change audience segments,2019,Wonneberger et al.,Yes,876,Climate Change,,Environment,TV news,Video&TV,Image,None,"Belief change,Engagement,Intention to act","Other,Other,Action related",Behavioral,Questionnaire,None,None,N/A,(1) media effects may be limited in changing public opinion due to dis(confirmation) effects
,Public Understanding of Science,"Adolescent responses toward a new technology: first associations,information seeking and affective responses to ecogenomics",2009,Bos et al.,Yes,752,Economics,,Other,General text,Other,Text,None,"Information seeking,Perceived credibility","Epistemic processes,Messenger perception",Behavioral,"open/closed questions,trust questionnaire,information intention questionnaire",Trust,Love,Input,"(1) adolescent information seeking is mostly internet,books and science communication professionals were judged as most trustworthy information source"
,Public Understanding of Science,Conflicting stories about public scientific controversies: Effects of news convergence and divergence on scientists’ credibility,2012,Jensen & Hurley,Yes,242,General environment,,Other,News article,Articles,Text,convergent/divergent,Perceived certainty,Message perception,Epistemic,"perceived uncertainty,perceived trustworthiness",None,None,N/A,(1) (?)
,Public Understanding of Science,Persuasive images in popular science: Testing judgments of scientific reasoning and credibility,2012,Gruber & Dickerson,Yes,183,General Science,,Other,General article,Other,Text,image/no image,Perceived credibility,Messenger perception,Epistemic,credibility questionnaire,None,None,N/A,(1) images alone may not have strong effect on persuasiveness
,Public Understanding of Science,Abstract or concrete? The effect of Climate Change images on people’s estimation of egocentric psychological distance,2019,Duan et al,Yes,402,Climate Change,,Environment,"News article,TV news","Articles,Video&TV","Text,Image",abstract/concrete,Perceived psychological distance,Message perception,Epistemic,Questionnaire,None,None,N/A,(1) abstract images increase perception of Climate Change as distant issue
,Public Understanding of Science,Framing effects on risk perception of nanotechnology,2008,Schütz & Wiedermann,Yes,194,Nanotechnology,,Technology,General text,Other,Text,issue framing/context framing,Perceived risk,Subject perception,Epistemic,probability of risk scenarios,None,None,N/A,(1) different types of benefit framing does not affect risk perception
,Public Understanding of Science,Naming is framing: The framing effect of technology name on public attitude toward automated vehicles,2021,Liu et al.,Yes,908,Automated vehicles,,Technology,General text,Other,Text,automated/driverless,"Perceived benefit,Intention to act","Subject perception,Action related","Behavioral,Epistemic",Questionnaire,None,None,N/A,(1) Technology naming influence behavioral intention through cognitive and affective responses
,Public Understanding of Science,Transformation of the media landscape: Infotainment versus expository narrations for communicating science in online videos,2020,Davis et al.,Yes,870,Climate Change,,Environment,Video,Video&TV,Image,expository/infotainment,"Perceived credibility,Perceived likability","Messenger perception,Messenger perception",Epistemic,Questionnaire,None,None,N/A,"(1) expository narration is liked and believed more than infotainment. However,viewers without university hbackground prefer infotainment."
,Public Understanding of Science,"Knowledge,(mis-)conceptions,risk perception,and behavior change during pandemics: A scoping review of 149 studies",2020,Majid et al.,"No,Review",149,General Health,,Health,None,Other,None,None,"Perceived risk,Behavioral change","Subject perception,Action related","Behavioral,Epistemic",Literature review,None,None,N/A,(?)
